<?xml version="1.0" encoding="UTF-8"?>
<odisee xmlns="http://xmlns.odisee.de/v3/request"
        xmlns:xsi="http://www.w3.org/2001/XMLSchema-instance"
        xsi:schemaLocation="http://xmlns.odisee.de/v3/request request_v3.xsd">
    <request name="EdhZMPj">
        <template name="MSnpMoD2y9ZKR27v" revision="BLA" />
        <instructions>
            <image type="Fs8qq" bookmark="qMjD3a4BW_UzjLCs-YHNIml" url="chMRLIK" width="4000" height="2000" post-macro="JJa9k6E9dTor_Y2Q-xCJx0CjgoC" />
            <autotext group="vgrSFQu6Yos" name="u8pl2GbL2zoCCVaNXFeTwkeh" bookmark="tADinIAcf345tXu" atend="true" />
            <bookmark name="SPD4Ohj.-xtH0WAGZuotY.79zvc7t" post-macro="PsFz5Bk._f6n6G5ulvPcHrHHl" />
            <macro name="sHqaL.tabhbmoybjPZ-Uc" language="Basic" location="document">
                <parameter value="qT-MOMfjMhe5_IiLncBVlyo" />
            </macro>
            <userfield name="d4Rkpg5thx0KPHy2iI" post-macro="r_LFCJ-2on8X474uoxpY" />
            <texttable name="K1uaKvmN" coordinate="HXz9" cell-align="rPVViIKbmveX7zTIc07php" cell-width="JFFeeGYPqxrt1Yjj9" post-macro="twq9qw" />
        </instructions>
        <post-process>
            <action type="UP5AqqEb4gn9Tjj0dH3OPOO6-">
                <result-placeholder />
                <input filename="rYmVBlUI60_dVGJDV" />
            </action>
        </post-process>
        <output>
            <format type="pdfa">
                <options>
                    <option name="bla" value="blub" />
                </options>
            </format>
        </output>
        <archive database="false" files="false" />
    </request>
    <post-process>
        <action type="wIE2yleqd">
            <result-placeholder />
            <input filename="xXvjW.pVdXuVCsXwX0teX-i0vvoA" />
        </action>
    </post-process>
    <response>
        <base64>false</base64>
    </response>
</odisee>
